{
  "$schema": "https://json-schema.org/draft/2020-12/schema",
  "title": "Amaryllis Verify Manifest v1alpha1",
  "type": "object",
  "additionalProperties": false,
  "required": [
    "apiVersion",
    "kind",
    "metadata",
    "subject",
    "target",
    "scenario",
    "collect",
    "policy"
  ],
  "properties": {
    "apiVersion": {
      "const": "amaryllis.dev/verify/v1alpha1"
    },
    "kind": {
      "const": "VerificationManifest"
    },
    "metadata": {
      "type": "object",
      "additionalProperties": false,
      "required": [
        "name"
      ],
      "properties": {
        "name": {
          "type": "string",
          "pattern": "^[a-z0-9][a-z0-9.-]{0,127}$"
        },
        "labels": {
          "type": "object",
          "maxProperties": 32,
          "additionalProperties": {
            "type": "string",
            "maxLength": 120
          }
        }
      }
    },
    "subject": {
      "$ref": "common.schema.json#/$defs/subject"
    },
    "target": {
      "$ref": "common.schema.json#/$defs/platformTarget"
    },
    "scenario": {
      "type": "object",
      "additionalProperties": false,
      "required": [
        "id",
        "version",
        "timeoutMs",
        "repetitions"
      ],
      "properties": {
        "id": {
          "type": "string",
          "pattern": "^[A-Za-z0-9][A-Za-z0-9._-]{0,127}$"
        },
        "version": {
          "type": "string",
          "minLength": 1,
          "maxLength": 100
        },
        "timeoutMs": {
          "type": "integer",
          "minimum": 1,
          "maximum": 3600000
        },
        "warmupRuns": {
          "type": "integer",
          "minimum": 0,
          "maximum": 100,
          "default": 0
        },
        "repetitions": {
          "type": "integer",
          "minimum": 1,
          "maximum": 100
        },
        "fixtureRefs": {
          "type": "array",
          "maxItems": 32,
          "items": {
            "type": "object",
            "additionalProperties": false,
            "required": [
              "id",
              "ref"
            ],
            "properties": {
              "id": {
                "type": "string",
                "pattern": "^[A-Za-z0-9][A-Za-z0-9._-]{0,127}$"
              },
              "ref": {
                "type": "string",
                "minLength": 1,
                "maxLength": 500
              },
              "digest": {
                "$ref": "common.schema.json#/$defs/digest"
              },
              "evidencePolicy": {
                "const": "exclude-content"
              }
            }
          }
        }
      }
    },
    "collect": {
      "type": "object",
      "additionalProperties": false,
      "required": [
        "metrics",
        "checks"
      ],
      "properties": {
        "metrics": {
          "type": "array",
          "uniqueItems": true,
          "maxItems": 128,
          "items": {
            "type": "string",
            "pattern": "^[A-Za-z0-9][A-Za-z0-9._-]{0,127}$"
          }
        },
        "checks": {
          "type": "array",
          "uniqueItems": true,
          "maxItems": 128,
          "items": {
            "type": "string",
            "pattern": "^[A-Za-z0-9][A-Za-z0-9._-]{0,127}$"
          }
        },
        "evaluations": {
          "type": "array",
          "uniqueItems": true,
          "maxItems": 64,
          "items": {
            "type": "string",
            "pattern": "^[A-Za-z0-9][A-Za-z0-9._-]{0,127}$"
          }
        }
      }
    },
    "policy": {
      "type": "object",
      "additionalProperties": false,
      "required": [
        "requirements"
      ],
      "properties": {
        "profileId": {
          "type": "string",
          "minLength": 1,
          "maxLength": 200
        },
        "requirements": {
          "type": "array",
          "maxItems": 256,
          "items": {
            "$ref": "common.schema.json#/$defs/requirement"
          }
        }
      }
    },
    "output": {
      "type": "object",
      "additionalProperties": false,
      "properties": {
        "path": {
          "type": "string",
          "minLength": 1,
          "maxLength": 500
        },
        "humanSummary": {
          "type": "boolean",
          "default": true
        }
      }
    }
  }
}
